{
  "schemaVersion": "1.0.0",
  "manifestId": "tale:capability-manifest:core",
  "registryVersion": "1.0.0",
  "capabilities": [
    {
      "id": "artifact.get",
      "version": "1.0.0",
      "description": "Retrieve one artifact by stable ID or alias.",
      "availability": [
        "api",
        "cli"
      ],
      "status": "available"
    },
    {
      "id": "artifact.search",
      "version": "1.0.0",
      "description": "Search mixed artifact kinds with stable identifiers.",
      "availability": [
        "api",
        "cli"
      ],
      "status": "available"
    },
    {
      "id": "code.validate",
      "version": "1.0.0",
      "description": "Validate consumer code locally with bounded registry and TypeScript checks.",
      "availability": [
        "api",
        "cli",
        "local-mcp"
      ],
      "status": "available"
    },
    {
      "id": "component.get",
      "version": "1.0.0",
      "description": "Retrieve the canonical component registry payload.",
      "availability": [
        "api",
        "local-mcp"
      ],
      "status": "available"
    },
    {
      "id": "manifest.get",
      "version": "1.0.0",
      "description": "Retrieve correlated contract, registry, package, and capability versions.",
      "availability": [
        "api",
        "cli"
      ],
      "status": "available"
    },
    {
      "id": "project.mutate",
      "version": "1.0.0",
      "description": "Perform root-confined, journaled, recoverable project mutations.",
      "availability": [
        "api",
        "cli"
      ],
      "status": "available"
    },
    {
      "id": "recipe.get",
      "version": "1.0.0",
      "description": "Retrieve a canonical recipe document.",
      "availability": [
        "api",
        "local-mcp"
      ],
      "status": "available"
    },
    {
      "id": "ui.plan",
      "version": "1.0.0",
      "description": "Plan UI with bounded registry and recipe context.",
      "availability": [
        "api",
        "local-mcp"
      ],
      "status": "available"
    }
  ],
  "digest": "sha256:1c79ad64ffb3f61060cfa77ab37f344e2888b7151dcd7e26ae5e0fd031ff1362"
}
